{
  "schema_version": "WitnessSet.v1",
  "produced_by": "scripts/witness_example_generator.py",
  "incident_id": "incident-20260313-235921",
  "metrics": {
    "candidate_count": 170,
    "accepted_count": 51,
    "rejected_count": 119,
    "unsupported_count": 46
  },
  "witnesses": [
    {
      "witness_id": "incident-20260313-235921:environment_fact:0001",
      "witness_type": "environment_fact",
      "statement": "appVersion=1.0",
      "provenance": {
        "source_incident_ids": [
          "incident-20260313-235921"
        ],
        "raw_field_refs": [
          "metadata.appVersion"
        ],
        "breadcrumb_refs": [],
        "log_refs": [],
        "screenshot_refs": [],
        "verifier_refs": [
          "witness_proposer:metadata"
        ]
      },
      "kind": "environment_fact",
      "content": "appVersion=1.0",
      "source_field": "metadata.appVersion"
    },
    {
      "witness_id": "incident-20260313-235921:environment_fact:0002",
      "witness_type": "environment_fact",
      "statement": "buildNumber=1",
      "provenance": {
        "source_incident_ids": [
          "incident-20260313-235921"
        ],
        "raw_field_refs": [
          "metadata.buildNumber"
        ],
        "breadcrumb_refs": [],
        "log_refs": [],
        "screenshot_refs": [],
        "verifier_refs": [
          "witness_proposer:metadata"
        ]
      },
      "kind": "environment_fact",
      "content": "buildNumber=1",
      "source_field": "metadata.buildNumber"
    },
    {
      "witness_id": "incident-20260313-235921:environment_fact:0003",
      "witness_type": "environment_fact",
      "statement": "deviceModel=iPhone",
      "provenance": {
        "source_incident_ids": [
          "incident-20260313-235921"
        ],
        "raw_field_refs": [
          "metadata.deviceModel"
        ],
        "breadcrumb_refs": [],
        "log_refs": [],
        "screenshot_refs": [],
        "verifier_refs": [
          "witness_proposer:metadata"
        ]
      },
      "kind": "environment_fact",
      "content": "deviceModel=iPhone",
      "source_field": "metadata.deviceModel"
    },
    {
      "witness_id": "incident-20260313-235921:environment_fact:0004",
      "witness_type": "environment_fact",
      "statement": "osVersion=26.3.1",
      "provenance": {
        "source_incident_ids": [
          "incident-20260313-235921"
        ],
        "raw_field_refs": [
          "metadata.osVersion"
        ],
        "breadcrumb_refs": [],
        "log_refs": [],
        "screenshot_refs": [],
        "verifier_refs": [
          "witness_proposer:metadata"
        ]
      },
      "kind": "environment_fact",
      "content": "osVersion=26.3.1",
      "source_field": "metadata.osVersion"
    },
    {
      "witness_id": "incident-20260313-235921:ui_fact:0005",
      "witness_type": "ui_fact",
      "statement": "screenName=Estimate",
      "provenance": {
        "source_incident_ids": [
          "incident-20260313-235921"
        ],
        "raw_field_refs": [
          "metadata.screenName"
        ],
        "breadcrumb_refs": [],
        "log_refs": [],
        "screenshot_refs": [],
        "verifier_refs": [
          "witness_proposer:metadata"
        ]
      },
      "kind": "ui_fact",
      "content": "screenName=Estimate",
      "source_field": "metadata.screenName"
    },
    {
      "witness_id": "incident-20260313-235921:observed_state:0006",
      "witness_type": "observed_state",
      "statement": "timestamp=2026-03-14T06:59:21Z",
      "provenance": {
        "source_incident_ids": [
          "incident-20260313-235921"
        ],
        "raw_field_refs": [
          "metadata.timestamp"
        ],
        "breadcrumb_refs": [],
        "log_refs": [],
        "screenshot_refs": [],
        "verifier_refs": [
          "witness_proposer:metadata"
        ]
      },
      "kind": "observed_state",
      "content": "timestamp=2026-03-14T06:59:21Z",
      "source_field": "metadata.timestamp"
    },
    {
      "witness_id": "incident-20260313-235921:ui_fact:0007",
      "witness_type": "ui_fact",
      "statement": "screenshot=incident-20260313-235921-screenshot.jpg",
      "provenance": {
        "source_incident_ids": [
          "incident-20260313-235921"
        ],
        "raw_field_refs": [
          "screenshotFilename"
        ],
        "breadcrumb_refs": [],
        "log_refs": [],
        "screenshot_refs": [
          "incident-20260313-235921-screenshot.jpg"
        ],
        "verifier_refs": [
          "witness_proposer:screenshot"
        ]
      },
      "kind": "ui_fact",
      "content": "screenshot=incident-20260313-235921-screenshot.jpg",
      "source_field": "screenshotFilename"
    },
    {
      "witness_id": "incident-20260313-235921:system_fact:0008",
      "witness_type": "system_fact",
      "statement": "direction=collapse",
      "provenance": {
        "source_incident_ids": [
          "incident-20260313-235921"
        ],
        "raw_field_refs": [
          "breadcrumbs[1]"
        ],
        "breadcrumb_refs": [
          "breadcrumbs[1]"
        ],
        "log_refs": [
          "breadcrumbs[1]"
        ],
        "screenshot_refs": [],
        "verifier_refs": [
          "witness_proposer:breadcrumb.log"
        ]
      },
      "kind": "system_fact",
      "content": "direction=collapse",
      "source_field": "breadcrumbs[1]",
      "timestamp": "2026-03-14T06:59:12Z"
    },
    {
      "witness_id": "incident-20260313-235921:system_fact:0009",
      "witness_type": "system_fact",
      "statement": "rowRectHeight=782.667",
      "provenance": {
        "source_incident_ids": [
          "incident-20260313-235921"
        ],
        "raw_field_refs": [
          "breadcrumbs[1]"
        ],
        "breadcrumb_refs": [
          "breadcrumbs[1]"
        ],
        "log_refs": [
          "breadcrumbs[1]"
        ],
        "screenshot_refs": [],
        "verifier_refs": [
          "witness_proposer:breadcrumb.log"
        ]
      },
      "kind": "system_fact",
      "content": "rowRectHeight=782.667",
      "source_field": "breadcrumbs[1]",
      "timestamp": "2026-03-14T06:59:12Z"
    },
    {
      "witness_id": "incident-20260313-235921:system_fact:0010",
      "witness_type": "system_fact",
      "statement": "targetCellHeight=782.667",
      "provenance": {
        "source_incident_ids": [
          "incident-20260313-235921"
        ],
        "raw_field_refs": [
          "breadcrumbs[1]"
        ],
        "breadcrumb_refs": [
          "breadcrumbs[1]"
        ],
        "log_refs": [
          "breadcrumbs[1]"
        ],
        "screenshot_refs": [],
        "verifier_refs": [
          "witness_proposer:breadcrumb.log"
        ]
      },
      "kind": "system_fact",
      "content": "targetCellHeight=782.667",
      "source_field": "breadcrumbs[1]",
      "timestamp": "2026-03-14T06:59:12Z"
    },
    {
      "witness_id": "incident-20260313-235921:system_fact:0011",
      "witness_type": "system_fact",
      "statement": "transitionSeq=3",
      "provenance": {
        "source_incident_ids": [
          "incident-20260313-235921"
        ],
        "raw_field_refs": [
          "breadcrumbs[2]"
        ],
        "breadcrumb_refs": [
          "breadcrumbs[2]"
        ],
        "log_refs": [
          "breadcrumbs[2]"
        ],
        "screenshot_refs": [],
        "verifier_refs": [
          "witness_proposer:breadcrumb.log"
        ]
      },
      "kind": "system_fact",
      "content": "transitionSeq=3",
      "source_field": "breadcrumbs[2]",
      "timestamp": "2026-03-14T06:59:12Z"
    },
    {
      "witness_id": "incident-20260313-235921:system_fact:0012",
      "witness_type": "system_fact",
      "statement": "baselineTargetHeight=782.667",
      "provenance": {
        "source_incident_ids": [
          "incident-20260313-235921"
        ],
        "raw_field_refs": [
          "breadcrumbs[2]"
        ],
        "breadcrumb_refs": [
          "breadcrumbs[2]"
        ],
        "log_refs": [
          "breadcrumbs[2]"
        ],
        "screenshot_refs": [],
        "verifier_refs": [
          "witness_proposer:breadcrumb.log"
        ]
      },
      "kind": "system_fact",
      "content": "baselineTargetHeight=782.667",
      "source_field": "breadcrumbs[2]",
      "timestamp": "2026-03-14T06:59:12Z"
    },
    {
      "witness_id": "incident-20260313-235921:system_fact:0013",
      "witness_type": "system_fact",
      "statement": "event=animation.start",
      "provenance": {
        "source_incident_ids": [
          "incident-20260313-235921"
        ],
        "raw_field_refs": [
          "breadcrumbs[3]"
        ],
        "breadcrumb_refs": [
          "breadcrumbs[3]"
        ],
        "log_refs": [
          "breadcrumbs[3]"
        ],
        "screenshot_refs": [],
        "verifier_refs": [
          "witness_proposer:breadcrumb.log"
        ]
      },
      "kind": "system_fact",
      "content": "event=animation.start",
      "source_field": "breadcrumbs[3]",
      "timestamp": "2026-03-14T06:59:12Z"
    },
    {
      "witness_id": "incident-20260313-235921:system_fact:0014",
      "witness_type": "system_fact",
      "statement": "event=animation.batch.begin",
      "provenance": {
        "source_incident_ids": [
          "incident-20260313-235921"
        ],
        "raw_field_refs": [
          "breadcrumbs[4]"
        ],
        "breadcrumb_refs": [
          "breadcrumbs[4]"
        ],
        "log_refs": [
          "breadcrumbs[4]"
        ],
        "screenshot_refs": [],
        "verifier_refs": [
          "witness_proposer:breadcrumb.log"
        ]
      },
      "kind": "system_fact",
      "content": "event=animation.batch.begin",
      "source_field": "breadcrumbs[4]",
      "timestamp": "2026-03-14T06:59:12Z"
    },
    {
      "witness_id": "incident-20260313-235921:system_fact:0015",
      "witness_type": "system_fact",